{"Name": "Marries Wedding",
  "Desc": "The Dance Marrie's Wedding",
  "shape": "3/4",
  "FigureList": ["s",[
					["p", [["s",[[[1,1], ["1cRT"  ,[]]], [[1,1], ["1cCast1p",[]]]]],
                          ["s",[[[2,1], ["1cWait",[]]], [[2,1], ["1cSU",    []]]]],
                          ["s",[[[3,1], ["1cWait",[]]], [[3,1], ["1cWait",  []]]]]]],
                    ["p", [                              [[2,1], ["1cLT1c",  []]],
                          ["s",[[[1,1], ["1cWait",[]]], [[1,1], ["1cWait",  []]]]],
                          ["s",[[[3,1], ["1cWait",[]]], [[3,1], ["1cWait",  []]]]]]],
                    ["p", [
                          [[1,1], ["H1DR",["E2c"]]],
                          ["s",[[[1,3], ["1pWait", []]], [[1,3], ["1pWait", []]]]],
                          ["s",[[[3,1], ["1pWait", []]], [[3,1], ["1pWait", []]]]]]],
                    ["p", [
                          [[1,1], ["H2DR", ["E3c"]]],
                          ["s",[[[1,1], ["1pWait", []]], [[1,1], ["1pWait", []]]]],
                          ["s",[[[3,3], ["1pWait", []]], [[3,3], ["1pWait", []]]]]]],
                    ["p", [
                          [[1,1], ["H1DR",["E2c"]]],
                          ["s",[[[1,3], ["1pWait", []]], [[1,3], ["1pWait", []]]]],
                          ["s",[[[3,1], ["1pWait", []]], [[3,1], ["1pWait", []]]]]]],
					["p", [
                          [[1,1], ["H2DR", ["ESL"]]],
                          ["s",[[[1,1], ["1pWait", []]], [[1,1], ["1pWait", []]]]],
                          ["s",[[[3,3], ["1pWait", []]], [[3,3], ["1pWait", []]]]]]],
					["p", [
                          [[1,1], ["HLReelAU", ["SDown"]]],
                          [[3,1], ["HLReelAD", ["SUp"]]]]],
                    ["p", [
                          [[1,1], ["HRReelAU", ["EDown"  ]]],
                          [[3,1], ["HRReelAD", ["EUp"]]]]],
                    [[1,1], ["6Hrb",[]]]]],
  "Version": 3}