{"Name": "Marries Wedding",
  "Desc": "The Dance Marrie's Wedding",
  "shape": "3/4",
  "FigureList": ["s",[
					[[1,1], ["Marries Wedding_Bar 1-8"  ,[]]],
					[[1,1], ["Marries Wedding_Bar 9-12"  ,[]]], 
					[[1,1], ["Marries Wedding_Bar 13-16"  ,[]]], 
					[[1,1], ["Marries Wedding_Bar 9-12"  ,[]]], 
					[[1,1], ["Marries Wedding_Bar 21-24"  ,[]]], 
					[[1,1], ["Marries Wedding_Bar 25-32"  ,[]]], 
					[[1,1], ["6Hrb",[]]]]],
  "Version": 3}